{
  "$schema": "https://json-schema.org/draft/2020-12/schema",
  "title": "dark-factory project profile",
  "description": "Contents of .factory/profile.json in a consumer project. The profile only adds project-specific values to the factory core; it cannot remove or override anything the core ships. Every element is off unless the profile enables it.",
  "type": "object",
  "additionalProperties": false,
  "required": ["branchTemplate", "apps"],
  "properties": {
    "$schema": {
      "description": "Optional reference to this schema, for editor support.",
      "type": "string"
    },
    "branchTemplate": {
      "description": "Branch name template for task branches. Placeholders: {issue} (issue number) and {slug} (title slug), for example \"task/ISSUE-{issue}-{slug}\".",
      "type": "string",
      "minLength": 1
    },
    "githubProject": {
      "description": "Optional number of the GitHub Project the project issues are tracked in.",
      "type": "integer",
      "minimum": 1
    },
    "install": {
      "description": "Project-level dependency installation steps, run in a fresh clone once and in order before the installation steps of any app. Same command contract as apps[].install (argv array, no shell; cwd relative to the project root). Optional; absent or empty means no steps and nothing is added implicitly. The token {file} is a literal here, never substituted.",
      "type": "array",
      "items": { "$ref": "#/$defs/command" }
    },
    "apps": {
      "description": "Application layout of the project. A single-package project lists one app with path \".\"; a monorepo lists one app per package.",
      "type": "array",
      "minItems": 1,
      "items": {
        "type": "object",
        "additionalProperties": false,
        "required": ["name", "path"],
        "properties": {
          "name": {
            "description": "Short app name, unique within the profile.",
            "type": "string",
            "minLength": 1
          },
          "path": {
            "description": "App directory relative to the project root; \".\" for a package in the root.",
            "type": "string",
            "minLength": 1
          },
          "install": {
            "description": "Dependency installation steps run in a fresh clone, in order. Optional; no steps by default.",
            "type": "array",
            "items": { "$ref": "#/$defs/command" }
          },
          "gate": {
            "description": "Gate commands run for this app before a commit, in order. Optional; no gate by default.",
            "type": "array",
            "items": { "$ref": "#/$defs/command" }
          }
        }
      }
    },
    "docOnlyPathPatterns": {
      "description": "Glob patterns of paths whose changes are documentation only and do not count as code changes.",
      "type": "array",
      "items": { "type": "string", "minLength": 1 }
    },
    "protectedPaths": {
      "description": "Glob patterns of paths the Ralph agent must not change.",
      "type": "array",
      "items": { "type": "string", "minLength": 1 }
    },
    "labels": {
      "description": "GitHub label names used by the factory.",
      "type": "object",
      "additionalProperties": false,
      "properties": {
        "humanNeeded": {
          "description": "Label that marks an issue or PR as needing a human.",
          "type": "string",
          "minLength": 1
        },
        "calibration": {
          "description": "Label that, set by an owner on an issue or its PR, asks Calibration Judge to analyse a failed verifier round. Required when judge.enabled is true.",
          "type": "string",
          "minLength": 1
        }
      }
    },
    "verifier": {
      "description": "Acceptance Verifier settings. The verdict itself is computed by code; these values only locate inputs and name the result.",
      "type": "object",
      "additionalProperties": false,
      "properties": {
        "verdictCheckName": {
          "description": "Name of the status check that carries the verifier verdict.",
          "type": "string",
          "minLength": 1
        },
        "goldenDir": {
          "description": "Directory of reference cases (inputs with an expected verdict), relative to the project root. The golden eval reads its cases only from here; without it the eval fails instead of using a default.",
          "type": "string",
          "minLength": 1
        },
        "checks": {
          "description": "Names of the deterministic verifier checks that run for this project (core checks: spec-approval, affects-scope, computed-items, test-tampering-scan, references, ci-checks, allowed-model). Checks not listed stay off; none run by default. A name no registered check has fails the verdict.",
          "type": "array",
          "uniqueItems": true,
          "items": { "type": "string", "minLength": 1 }
        }
      }
    },
    "skillRules": {
      "description": "Project entries of the shared \"path to skills\" table. They are added to the core table and cannot remove or override its entries.",
      "type": "array",
      "items": {
        "type": "object",
        "additionalProperties": false,
        "required": ["path", "extensions", "label", "skills"],
        "properties": {
          "path": {
            "description": "Path prefix, relative to the project root, that the entry applies to.",
            "type": "string",
            "minLength": 1
          },
          "extensions": {
            "description": "File extensions that the entry applies to, each with the leading dot. Plain (\".ts\") and compound (\".test.ts\", \".d.ts\") extensions are accepted; every segment after a dot is non-empty and contains no whitespace, \"/\" or backslash. An extension is matched as a suffix of the file name.",
            "type": "array",
            "minItems": 1,
            "items": { "type": "string", "pattern": "^(\\.[^.\\s/\\\\]+)+$" }
          },
          "label": {
            "description": "Human-readable label of the entry, shown in hook messages.",
            "type": "string",
            "minLength": 1
          },
          "skills": {
            "description": "Names of skills that must be loaded before editing matching files.",
            "type": "array",
            "minItems": 1,
            "items": { "type": "string", "minLength": 1 }
          }
        }
      }
    },
    "extraMetaskills": {
      "description": "Names of metaskills installed in the project in addition to the base set of the package.",
      "type": "array",
      "items": { "type": "string", "minLength": 1 }
    },
    "ruleFiles": {
      "description": "Project rule files (for example a CLAUDE.md) that agents must read, relative to the project root.",
      "type": "array",
      "items": { "type": "string", "minLength": 1 }
    },
    "overlays": {
      "description": "Project overlays of document templates, relative to .factory/overlays/. An overlay can only add to a core template.",
      "type": "object",
      "additionalProperties": false,
      "properties": {
        "prd": { "description": "Overlay file for the PRD template.", "type": "string", "minLength": 1 },
        "plan": { "description": "Overlay file for the plan template.", "type": "string", "minLength": 1 },
        "issue": { "description": "Overlay file for the issue template.", "type": "string", "minLength": 1 }
      }
    },
    "docs": {
      "description": "Locations of project documents, relative to the project root.",
      "type": "object",
      "additionalProperties": false,
      "properties": {
        "prd": { "description": "Directory with PRD documents.", "type": "string", "minLength": 1 },
        "plans": { "description": "Directory with plans.", "type": "string", "minLength": 1 },
        "adr": { "description": "Directory with architecture decision records.", "type": "string", "minLength": 1 }
      }
    },
    "hooks": {
      "description": "Commands of the lint and typecheck hooks. A hook is inactive for paths that no entry matches. The event of a hook is bound to a changed file; the entry command may check that one file (pass it with the {file} token) or the whole project (omit the token).",
      "type": "object",
      "additionalProperties": false,
      "properties": {
        "lint": {
          "description": "Lint commands per path. On a changed file the hook runs every entry whose paths match the file (at least one pattern matches), in array order, each entry once however many of its patterns match. A failing or missing binary of one command is recorded in diagnostics and does not stop the following ones; the lint hook itself always exits 0. {file} in command.argv is substituted as described in hookCommand.",
          "type": "array",
          "items": { "$ref": "#/$defs/hookCommand" }
        },
        "typecheck": {
          "description": "Typecheck commands per path. Selection and execution are the same as for hooks.lint: every entry that matches the changed file, in array order, once each; a failure of one command is recorded in diagnostics and does not stop the following ones; the typecheck hook always exits 0. {file} in command.argv is substituted as described in hookCommand.",
          "type": "array",
          "items": { "$ref": "#/$defs/hookCommand" }
        }
      }
    },
    "agentEnvironment": {
      "description": "Environment constraints stated to the Ralph agent in its prompt (for example tools that are unavailable). The sandbox section is added by a later schema revision.",
      "type": "array",
      "items": { "type": "string", "minLength": 1 }
    },
    "judge": {
      "description": "Calibration Judge, the optional observer that analyses failed Acceptance Verifier rounds. Off unless \"enabled\" is true; a disabled Judge needs no other fields. Judge only observes: it never changes a verdict, a status or a label.",
      "type": "object",
      "additionalProperties": false,
      "properties": {
        "enabled": {
          "description": "Whether Judge runs in this project, in any way of starting it. Absent or false means off. When true, labels.calibration is required.",
          "type": "boolean",
          "default": false
        }
      }
    },
    "ralph": {
      "description": "Ralph, the autonomous issue-executing agent. Off unless \"enabled\" is true; a disabled Ralph needs no other fields.",
      "type": "object",
      "additionalProperties": false,
      "required": ["enabled"],
      "properties": {
        "enabled": {
          "description": "Whether Ralph runs in this project. When false, no other ralph field is required.",
          "type": "boolean"
        },
        "techDebtTrackerIssue": {
          "description": "Number of the issue that collects tech-debt items. Required when Ralph is enabled.",
          "type": "integer",
          "minimum": 1
        },
        "humanNeededVerdict": {
          "description": "Name of the verdict with which the Ralph agent reports that a human decision is needed (for example BLOCKED-<REASON>). Optional; absent means none is configured and nothing is assumed. A non-empty string without whitespace (a trailing newline included) and without a colon; it must not be a service token (DONE, BLOCKED, TYPE, SUMMARY, REVIEW, CODEREVIEW). Regex characters are allowed and are interpreted literally by the reader. It is not the label labels.humanNeeded and not the verifier status check verifier.verdictCheckName.",
          "type": "string",
          "pattern": "^(?!(?:DONE|BLOCKED|TYPE|SUMMARY|REVIEW|CODEREVIEW)$)[^\\s:]+$"
        },
        "enabledSteps": {
          "description": "Names of optional Ralph steps switched on for this project. Steps not listed stay off. Required (may be empty) when Ralph is enabled.",
          "type": "array",
          "uniqueItems": true,
          "items": { "type": "string", "minLength": 1 }
        }
      },
      "if": {
        "properties": { "enabled": { "const": true } },
        "required": ["enabled"]
      },
      "then": {
        "required": ["techDebtTrackerIssue", "enabledSteps"]
      }
    }
  },
  "allOf": [
    {
      "if": {
        "properties": { "judge": { "properties": { "enabled": { "const": true } }, "required": ["enabled"] } },
        "required": ["judge"]
      },
      "then": {
        "required": ["labels"],
        "properties": { "labels": { "required": ["calibration"] } }
      }
    }
  ],
  "$defs": {
    "command": {
      "description": "A command as an argument array (not a shell string) plus its working directory. The strings are passed as they are: the token {file} is substituted only inside hooks.lint[].command.argv and hooks.typecheck[].command.argv (see hookCommand); in install and gate commands it is a plain literal.",
      "type": "object",
      "additionalProperties": false,
      "required": ["argv", "cwd"],
      "properties": {
        "argv": {
          "description": "Program followed by its arguments: [program, ...args].",
          "type": "array",
          "minItems": 1,
          "items": { "type": "string" }
        },
        "cwd": {
          "description": "Working directory relative to the project root; \".\" for the root.",
          "type": "string",
          "minLength": 1
        }
      }
    },
    "hookCommand": {
      "description": "A hook command bound to the paths it applies to. paths are glob expressions with minimatch semantics (*, ** and {a,b}), relative to the project root and written with \"/\"; the changed file path is made relative with \"/\" before matching. ** matches zero or more directories, so **/*.ts also matches x.ts in the root. Options: dot true, nocase false, matchBase false, nonegate true, nocomment true; braces and globstar stay enabled. A file outside the project root matches no entry. In command.argv the optional token {file} is replaced, in every occurrence in every string element (also inside a longer element such as --file={file}), by the absolute path of the changed file inside the project root, the same for any cwd. The result stays one argument: no shell, no extra quoting, no interpretation of path characters. cwd and other fields are not interpolated. Without the token the command runs with its arguments unchanged.",
      "type": "object",
      "additionalProperties": false,
      "required": ["paths", "command"],
      "properties": {
        "paths": {
          "description": "Glob patterns of the paths the command applies to.",
          "type": "array",
          "minItems": 1,
          "items": { "type": "string", "minLength": 1 }
        },
        "command": { "$ref": "#/$defs/command" }
      }
    }
  }
}
